"","GO.ID","Term","Annotated","Significant","Expected","Fisher"
"1","GO:0010750","positive regulation of nitric oxide mediated signal transduction",3,1,0,"0.00023"
"2","GO:0070141","response to UV-A",7,1,0,"0.00054"
"3","GO:1903800","positive regulation of production of miRNAs involved in gene silencing by miRNA",8,1,0,"0.00062"
"4","GO:1900020","positive regulation of protein kinase C activity",8,1,0,"0.00062"
"5","GO:1905208","negative regulation of cardiocyte differentiation",9,1,0,"0.00069"
